{
  "id": "ex.rice.white.cooked",
  "status": "stub",
  "identity": {
    "common_name": "cooked white rice",
    "form": "cooked",
    "family_hint": "Poaceae"
  },
  "cargo": [],
  "partners": [],
  "injection_zone": "zone1_matrix",
  "matrix": {
    "integrity": "unknown"
  },
  "teaching": {
    "point": "stub: refined grain rate",
    "gate": "open",
    "bound": "open",
    "book_ref": "open"
  }
}
