{
  "id": "ex.green.tea",
  "status": "filled",
  "identity": {
    "common_name": "green tea",
    "form": "unknown",
    "family_hint": "Theaceae"
  },
  "cargo": [],
  "partners": [
    {
      "field": "tea_tannins",
      "value": true,
      "concurrency": "same_meal",
      "derivation": "structural",
      "rationale": "tea polyphenols present by identity"
    }
  ],
  "injection_zone": "zone1_matrix",
  "matrix": {
    "integrity": "unknown"
  },
  "teaching": {
    "point": "stub: tannin partner open",
    "gate": "open",
    "bound": "open",
    "book_ref": "open"
  }
}
