{
  "id": "ex.protein.powder.whey",
  "status": "filled",
  "identity": {
    "common_name": "whey protein powder",
    "form": "flour",
    "family_hint": "supplement"
  },
  "cargo": [],
  "partners": [],
  "injection_zone": "zone2_cargo",
  "matrix": {
    "integrity": "destroyed",
    "derivation": "structural",
    "rationale": "isolated protein fraction; no food matrix remains"
  },
  "teaching": {
    "point": "stub: zone2 isolate",
    "gate": "open",
    "bound": "open",
    "book_ref": "open"
  }
}
