{
  "id": "ex.whole.wheat.bread",
  "status": "filled",
  "identity": {
    "common_name": "whole wheat bread",
    "form": "cooked",
    "family_hint": "Poaceae"
  },
  "method_identity": [
    {
      "op": "mill",
      "severity": "moderate",
      "target": "cell_wall",
      "matrix_effect": "partially_disrupts",
      "note": "wholemeal: bran and germ retained"
    },
    {
      "op": "ferment",
      "severity": "moderate",
      "target": "starch",
      "matrix_effect": "preserves"
    },
    {
      "op": "bake",
      "severity": "moderate",
      "target": "starch",
      "matrix_effect": "destroys"
    }
  ],
  "cargo": [],
  "partners": [],
  "injection_zone": "zone1_matrix",
  "matrix": {
    "integrity": "partial",
    "derivation": "structural",
    "rationale": "milled, but bran and germ fractions retained"
  },
  "teaching": {
    "point": "stub: coarser matrix prior vs white",
    "gate": "open",
    "bound": "open",
    "book_ref": "open"
  }
}
