{
  "id": "ex.coffee.black",
  "status": "filled",
  "identity": {
    "common_name": "black coffee",
    "form": "unknown",
    "family_hint": "Rubiaceae"
  },
  "cargo": [],
  "partners": [
    {
      "field": "tea_tannins",
      "value": true,
      "concurrency": "same_meal",
      "derivation": "structural",
      "rationale": "coffee polyphenols present by identity"
    }
  ],
  "injection_zone": "zone1_matrix",
  "matrix": {
    "integrity": "unknown"
  },
  "teaching": {
    "point": "stub: polyphenol/tannin-class partner open",
    "gate": "open",
    "bound": "open",
    "book_ref": "open"
  }
}
