{
  "id": "ex.canola.oil.dressing",
  "status": "filled",
  "identity": {
    "common_name": "canola oil salad dressing",
    "form": "oil",
    "family_hint": "mixed"
  },
  "cargo": [],
  "partners": [
    {
      "field": "lipid_phase_present",
      "value": true,
      "concurrency": "same_meal",
      "derivation": "structural",
      "rationale": "oil-based dressing; lipid phase is the vehicle"
    }
  ],
  "injection_zone": "zone1_matrix",
  "matrix": {
    "integrity": "unknown"
  },
  "teaching": {
    "point": "stub: fat vehicle grams open",
    "gate": "open",
    "bound": "open",
    "book_ref": "open"
  }
}
