{
  "id": "ex.chicken.breast",
  "status": "stub",
  "identity": {
    "common_name": "chicken breast",
    "form": "cooked",
    "family_hint": "Galliformes"
  },
  "cargo": [],
  "partners": [],
  "injection_zone": "zone1_matrix",
  "matrix": {
    "integrity": "unknown"
  },
  "teaching": {
    "point": "stub: meat factor partner open",
    "gate": "open",
    "bound": "open",
    "book_ref": "open"
  }
}
