{
  "id": "ex.orange.whole",
  "status": "filled",
  "identity": {
    "common_name": "whole orange",
    "form": "raw_whole",
    "family_hint": "Rutaceae"
  },
  "cargo": [],
  "partners": [],
  "injection_zone": "zone1_matrix",
  "matrix": {
    "integrity": "intact",
    "derivation": "structural",
    "rationale": "segment and cell-wall structure present"
  },
  "teaching": {
    "point": "stub: intact matrix vs juice",
    "gate": "open",
    "bound": "open",
    "book_ref": "open"
  }
}
