{
  "id": "ex.beef.ground",
  "status": "stub",
  "identity": {
    "common_name": "ground beef",
    "form": "cooked",
    "family_hint": "Bovidae"
  },
  "cargo": [],
  "partners": [],
  "injection_zone": "zone1_matrix",
  "matrix": {
    "integrity": "unknown"
  },
  "teaching": {
    "point": "stub: haem/nonhaem + fat open",
    "gate": "open",
    "bound": "open",
    "book_ref": "open"
  }
}
