{
  "id": "ex.avocado",
  "status": "filled",
  "identity": {
    "common_name": "avocado",
    "form": "raw_whole",
    "family_hint": "Lauraceae"
  },
  "cargo": [
    {
      "nutrient": "lipid",
      "label_amount": "open",
      "derivation": "structural",
      "rationale": "intrinsic lipid is the defining macronutrient"
    }
  ],
  "partners": [
    {
      "field": "lipid_phase_present",
      "value": true,
      "concurrency": "same_meal",
      "derivation": "structural",
      "rationale": "intrinsic lipid is the defining macronutrient of the fruit"
    }
  ],
  "injection_zone": "zone1_matrix",
  "matrix": {
    "integrity": "intact",
    "derivation": "structural",
    "rationale": "whole fruit flesh; lipid still cell-bound"
  },
  "teaching": {
    "point": "stub: native fat vehicle",
    "gate": "open",
    "bound": "open",
    "book_ref": "open"
  }
}
