{
  "id": "ex.walnut.whole",
  "status": "stub",
  "identity": {
    "common_name": "whole walnuts",
    "form": "raw_whole",
    "family_hint": "Juglandaceae"
  },
  "cargo": [],
  "partners": [],
  "injection_zone": "zone1_matrix",
  "matrix": {
    "integrity": "unknown"
  },
  "teaching": {
    "point": "stub: encapsulation prior",
    "gate": "open",
    "bound": "open",
    "book_ref": "open"
  }
}
