{
  "id": "ex.kale.raw",
  "status": "filled",
  "identity": {
    "common_name": "raw kale",
    "form": "raw_whole",
    "family_hint": "Brassicaceae"
  },
  "cargo": [
    {
      "nutrient": "beta_carotene",
      "label_amount": "open",
      "derivation": "structural",
      "rationale": "carotenoid occurrence in kale is undisputed"
    }
  ],
  "partners": [
    {
      "field": "lipid_phase_present",
      "value": false,
      "concurrency": "same_meal",
      "derivation": "structural",
      "rationale": "leafy green eaten alone; trace intrinsic lipid is below the micellar fat threshold (Brown 2004, AJCN 80:396)"
    }
  ],
  "injection_zone": "zone1_matrix",
  "matrix": {
    "integrity": "unknown"
  },
  "teaching": {
    "point": "stub: brassica cargo open",
    "gate": "open",
    "bound": "open",
    "book_ref": "open"
  }
}
